RestaurantID,ItemName,Description,Price,Category,Availability,ItemType
9,Pistachio Ice Cream,Creamy ice cream with pistachio nuts.,216,Ice Cream,True,Gluten-Free
9,Strawberry Delight,Strawberry-flavored ice cream with real strawberries.,237,Ice Cream,True,Gluten-Free
9,Masala Dosa,Crispy rice crepe filled with spiced potatoes.,85,South Indian,True,Gluten-Free
9,Butter Chicken,Tender chicken cooked in a creamy tomato sauce with spices.,169,North Indian,True,Veg
10,Masala Chai,Spiced tea brewed with milk and sugar.,112,Beverages,True,Non-Veg
10,Paneer Tikka,Marinated paneer grilled with spices and served with mint chutney.,210,North Indian,True,Veg